,id,title,author,author_flair_text,created_at,url,flair,is_original_content,distinguished,is_self,selftext,is_spoiler,is_over_18,subreddit,is_stickied,is_edited,is_locked,num_comments,upvote_ratio,score
632,5qhmyl,"Oneonta Falls in the Columbia River Gorge (OR) is an extremely popular swimming hole in the summer, but it takes on a whole new look in the winter... [OC] [800x1200]",steveschwindt,,1485530278.0,https://i.redd.it/jyjx1ksku9cy.jpg,,False,,False,,False,False,EarthPorn,False,False,False,508,0.91,34562
633,7abiun,"Thankfully some areas in the Columbia River Gorge were undamaged by the recent fire. Starvation Creek, Oregon, taken last week. [1800x1200] [OC]",TriumphantDonkey,,1509629702.0,https://i.imgur.com/mxs6z2D.jpg,[1202x1800],False,,False,,False,False,EarthPorn,False,False,False,347,0.92,34554
634,6iebt7,"When the sun hits, last day of spring in Fort Collins, Colorado [OC] [960x960]",Vostin,,1497968575.0,https://i.redd.it/9zim72dy7t4z.jpg,,False,,False,,False,False,EarthPorn,False,False,False,783,0.9,34551
635,7v9v5w,California at its finest [OC][2000x2500],explorewithdavid,,1517780741.0,https://i.redd.it/bu4kz78tn9e01.png,,False,,False,,False,False,EarthPorn,False,False,False,379,0.93,34521
636,86o8ho,"Stunning early morning light in the Hudson Valley, NY [OC] [4000x4000]",bgjammin,,1521839984.0,https://i.redd.it/9lr2m52zxkn01.jpg,,False,,False,,False,False,EarthPorn,False,False,False,464,0.93,34479
637,8y4cpx,"I waited all evening through overcast sky and even drove away, just to turn around after seeing the colors over Trillium Lake, Mt Hood, Oregon [OC][1440x960]",tmfp,,1531349956.0,https://imgur.com/gZBGcQn,,True,,False,,False,False,EarthPorn,False,False,False,254,0.92,34465
638,9m1fws,First Snow of Fall in Utah [OC][1228x1840],UtahPictures,,1538875914.0,https://i.imgur.com/KrnZMDY.jpg,,True,,False,,False,False,EarthPorn,False,False,False,249,0.94,34448
639,asj53j,"The 8 hour drive one-way was worth it, Yosemite Valley, CA [OC][5728 × 4000]",kirkyland,,1550632088.0,https://i.redd.it/7wycngcq3nh21.jpg,,True,,False,,False,False,EarthPorn,False,False,False,344,0.91,34452
640,ie7ye7,Decided to stop to get this shot while trail running Tokopah Valley in Sequoia National Park yesterday evening [OC] [2436x1125],ImDumbButSmart,,1598053090.0,https://i.redd.it/1ctye1n7yfi51.jpg,,False,,False,,False,False,EarthPorn,False,False,False,300,0.96,34450
641,88bcjw,"Heavenly pools and waterfalls on the Vietnam-China border - Ban Gioc Falls, Vietnam [OC][3992 × 2992]",Pr4w,,1522425153.0,https://i.redd.it/qslu7rx99xo01.jpg,[3992x2992],False,,False,,False,False,EarthPorn,False,False,False,280,0.95,34455
642,a5it84,"Cold, soaked, & stoked, Yosemite Valley mid snowstorm [OC][3648×5472]",franklinsteinnn,,1544626425.0,https://i.redd.it/6d9cmhwj1v321.jpg,,True,,False,,False,False,EarthPorn,False,False,False,307,0.95,34444
643,zy1vmb,A desert rose in Yemen. In the background the Arabic sea [OC] [1080x1080],marcograssiphoto,📷,1672308736.0,https://i.redd.it/c16fnydsat8a1.jpg,,False,,False,,False,False,EarthPorn,False,False,False,246,0.97,34443
644,92uhc2,"Yesterday's hazy sunrise from Valley View, Yosemite National Park [OC][3639×5458]",franklinsteinnn,,1532867858.0,https://i.redd.it/z16a5c8ftvc11.jpg,,True,,False,,False,False,EarthPorn,False,False,False,274,0.94,34440
645,nwne8n,Saw this within my first hour of entering Yosemite and my jaw dropped [OC][1500x1079],CampsG,,1623330970.0,https://i.redd.it/8uuyezewuf471.jpg,,False,,False,,False,False,EarthPorn,False,False,False,541,0.94,34434
646,662374,"The side of Machu Picchu you don't see [Machu Picchu, Peru] [OC] [3456x2304]",kwyk,,1492512648.0,http://i.imgur.com/KJMagHN.jpg,,False,,False,,False,False,EarthPorn,False,False,False,603,0.92,34406
647,fh5xxh,"The worse the weather, the better this place looks. A moody day at Milford Sound, New Zealand [OC][1294 × 1617] @phillipgow",CollideStorm,,1583966652.0,https://i.redd.it/j81yc8lig4m41.jpg,,True,,False,,False,False,EarthPorn,False,False,False,209,0.96,34390
648,8m0i71,"I can't believe I was the only one taking photos of these amazing reflections on that evening. Spring in Reine, Lofoten Islands, Norway. [OC][1676 × 2094]",CollideStorm,,1527241595.0,https://i.redd.it/ni7etk4z2zz01.jpg,/r/all,False,,False,,False,False,EarthPorn,False,False,False,204,0.92,34386
649,6ak0q8,"[OC] Beautifully blue water at Twilight Beach, Esperance, Western Australia [2000x2668]",apertunity_,,1494508360.0,https://i.redd.it/s9raq4p2fvwy.jpg,,False,,False,,False,False,EarthPorn,False,False,False,404,0.93,34369
650,65bgp2,Proof that California is finally out of the drought! (Wildflowers) [OC][7666x5113],JoshuaSortino,,1492159748.0,http://i.imgur.com/HRoAKgZ.jpg,,False,,False,,False,False,EarthPorn,False,False,False,1202,0.79,34338
651,aot52i,A foggy sunrise in Upstate New York [OC][1600X2000],nikn,,1549725280.0,https://i.redd.it/meucz1ja7kf21.jpg,,True,,False,,False,False,EarthPorn,False,False,False,329,0.95,34343
652,hknprl,"Walking among the giants, in the magical redwood forests of Big Sur, California [1600x2400][OC]",guitar805,,1593799040.0,https://i.redd.it/kghi7mu7lo851.jpg,,False,,False,,False,False,EarthPorn,False,False,False,333,0.96,34327
653,clva66,"Under the Sugar Pines Panorama - Laurel Hill, NSW, Australia [OC] [2953x 6608]",wunty,,1564917755.0,https://i.redd.it/udti3fht1fe31.jpg,,True,,False,,False,False,EarthPorn,False,False,False,243,0.96,34332
654,d9h1hk,"The best show on earth. Northern lights over Bruarfoss, Iceland {OC} (1500x1000)",william_patino,,1569488689.0,https://i.redd.it/rvtyubo5mwo31.jpg,,True,,False,,False,False,EarthPorn,False,False,False,325,0.95,34319
655,792lwy,"Beech vs Pine in The Hearg Woods, Denmark [OC] [800 x 1060]",dennisskyum,,1509103360.0,https://i.redd.it/0lla7a74xcuz.jpg,,False,,False,,False,False,EarthPorn,False,False,False,378,0.95,34323
656,9smpfy,The Milky Way setting behind a western Maine waterfall [OC][1000x1500],ilikefishwaytoomuch,,1540896401.0,https://static1.squarespace.com/static/59235f93c534a5d7bf48dec3/5a301c26e4966b2062f9a43c/5bc65ad3e79c7058a61a704d/1539726045498/ScrewAugerMW.jpg,[1000×1541],True,,False,,False,False,EarthPorn,False,False,False,342,0.95,34315
657,cxleuq,"Isle of Skye, Scotland [3000x3000][OC]",ChristophZee,,1567192153.0,https://i.redd.it/u0l9qpi6xmj31.jpg,,True,,False,,False,False,EarthPorn,False,False,False,376,0.96,34299
658,5cwabz,"Mount Shasta on a clear night, by Victor Carreiro [1200x800] [OC]",TriumphantDonkey,,1479134888.0,http://i.imgur.com/7BdSd82.jpg,,False,,False,,False,False,EarthPorn,False,False,False,604,0.92,34287
659,8bepka,"My Mom's Resting Place - Fremont Canyon, Wyoming [OC] (2992 x 4000)",greatunknowns,,1523424470.0,https://i.redd.it/hkty3qcqs7r01.jpg,,False,,False,,False,False,EarthPorn,False,False,False,283,0.91,34249
660,9srb5z,"A late afternoon at the lake in Flims, Switzerland (OC) (3840 × 4800)",Doeeme,,1540928551.0,https://i.redd.it/a2g3dw4zldv11.jpg,,True,,False,,False,False,EarthPorn,False,False,False,184,0.95,34214
661,7mmxhu,"It's like watching a green sunset on an alien planet. Jukkasjärvi, Sweden [7838x5531] [OC]",Tio76,,1514471890.0,https://i.imgur.com/0o6eiHB.jpg,,False,,False,,False,False,EarthPorn,False,False,False,264,0.94,34186
662,80qh0l,"When you get to the top and it was so worth it.. Looking across the valley at Mount Hood, Oregon [OC] [2400 x 3000]",nathanielthewise,,1519768315.0,https://i.redd.it/xy2pe0kqtti01.jpg,,False,,False,,False,False,EarthPorn,False,False,False,310,0.94,34178
663,h7if23,"After an amazing lightning storm, thick clouds broke just enough during sunrise to let this happen in Glacier National Park! (OC) [1333x2000] @ross_schram",debuggerfly,,1591958592.0,https://i.redd.it/3n5h69epkg451.jpg,,False,,False,,False,False,EarthPorn,False,False,False,228,0.96,34163
664,ao8rnr,"I'm 99.9% sure that Rivendell is just around the corner. Upper Twin Falls, WA [OC][2683x3495]",thebeaconsarelit420,,1549574430.0,https://i.redd.it/w77pwbauq7f21.jpg,,True,,False,,False,False,EarthPorn,False,False,False,323,0.93,34163
665,fro5yz,"I got lost completely in this crazy forest, Madeira, Portugal (1920x1278)[OC]",cryptodesign,,1585563334.0,https://i.redd.it/dt94tz18csp41.jpg,,False,,False,,False,False,EarthPorn,False,False,False,292,0.94,34159
666,5zbymr,Decided to walk 7 hours into the jungle in Columbia alone. This is what met me (discovered later that this is the worlds highest palmtree)[1334x750],massivitet,,1489496453.0,http://i.imgur.com/AVWfLgF.jpg,Probable OC - feedback needed from OP,False,,False,,False,False,EarthPorn,False,False,False,1891,0.65,34113
667,6ndnip,"Cotton Candy Skies over Mt. Hood and Trillium Lake, OR [OC][2260 × 3137]",beerbeerbeer0,,1500087088.0,http://i.imgur.com/TnvVA1y.jpg,[2260x3137],False,,False,,False,False,EarthPorn,False,False,False,222,0.92,34103
668,8u514l,"After working for a year, I finally made it to Iceland. [OC] [5184x3456]",VPAKing,,1530058152.0,https://i.redd.it/mhipxgqaqf611.jpg,,True,,False,,False,False,EarthPorn,False,False,False,487,0.93,34088
669,8ok0qq,"Toketee Falls, Oregon in the Winter. [1834 x 2750][OC]",childishharish,,1528139777.0,https://i.redd.it/7kt33m8m91211.jpg,/r/all,False,,False,,False,False,EarthPorn,False,False,False,271,0.94,34089
670,7jg4yj,"Reflections in snowy Sedona, Arizona [OC] [3500 x 2333]",amariswoo,,1513132822.0,https://i.redd.it/kpoxo8ivql301.jpg,,False,,False,,False,False,EarthPorn,False,False,False,539,0.94,34085
671,sm5v92,Everything frosted over and sun going down in rural Central Finland [1440x2160] [OC],joel7861,📷,1644177449.0,https://i.redd.it/ca5mvdj6q9g81.jpg,,False,,False,,False,False,EarthPorn,False,False,False,163,0.97,34071
672,azl71o,"Lake Tahoe, Nevada [OC] [3006 x 4008]",natesalkoff,,1552255982.0,https://i.redd.it/n6hhi8a68dl21.jpg,,True,,False,,False,False,EarthPorn,False,False,False,374,0.94,34070
673,byjydu,"Walking on the salt flats of Death Valley, California [oc][1533x2300]",Awayiflew,,1560085123.0,https://i.redd.it/pcx7gxegwb331.jpg,,True,,False,,False,False,EarthPorn,False,False,False,372,0.96,34063
674,96xpdj,"After 3 weeks of being closed, Yosemite National Park reopens tomorrow. [OC][3637×5457]",franklinsteinnn,,1534161635.0,https://i.redd.it/t0mqj9sunuf11.jpg,,True,,False,,False,False,EarthPorn,False,False,False,340,0.94,34015
675,72wtjh,"I drove 15 minutes from my house and walked 50 feet away from my car to catch this shot (Fort Ann, NY) [OC] [6021 × 40200",skupelshanks,,1506561306.0,https://i.redd.it/tz9j1e06yioz.jpg,,False,,False,,False,False,EarthPorn,False,False,False,532,0.85,33998
676,9kjfai,"The Neskowin Ghost Forest in Oregon, where ancient petrified tree stumps protrude from the sand at low tide [OC] [1200x1500]",TheLucidMan,,1538421687.0,https://i.redd.it/6vf777wqjmp11.jpg,,True,,False,,False,False,EarthPorn,False,False,False,302,0.95,33981
677,66ssku,"Forest in Tatra mountains, Slovakia [3718x2092] [OC]",NiloxCSGO,,1492817085.0,http://imgur.com/1w8VyzK,,False,,False,,False,False,EarthPorn,False,False,False,391,0.92,33983
678,cewsex,"An hour before this there was not a cloud in the sky. Glacier NP, MT. [OC](1500x1000)",suckerswag,,1563476991.0,https://i.redd.it/cqqncmmy14b31.jpg,,True,,False,,False,False,EarthPorn,False,False,False,398,0.96,33963
679,7rttn0,"Morning light in Yosemite National Park, California. [OC] (5000x4000)",erubes1,,1516489244.0,https://i.redd.it/ayc4k6c0zab01.jpg,[3926x4908],False,,False,,False,False,EarthPorn,False,False,False,224,0.94,33918
680,ark7ij,"Mount Herbert with the most active volcano in the Aleutian Chain - Mt Cleveland in the background. Alaska, [1080x1350]px by Chris Burkard.",effectivepep,,1550407177.0,https://instagram.fbeg2-1.fna.fbcdn.net/vp/d382cf1d7bc41f9c7423e81aa3d6ac4e/5D27F54C/t51.2885-15/e35/37272903_2350860081623167_2460526080285474816_n.jpg?_nc_ht=instagram.fbeg2-1.fna.fbcdn.net,,False,,False,,False,False,EarthPorn,False,False,False,176,0.96,33889
681,6v96af,"Clouds rolling over mountains. Senja, Norway. [OC] [3978x2743]",epaavola,,1503382820.0,https://i.redd.it/txbc6xxcf8hz.jpg,,False,,False,,False,False,EarthPorn,False,False,False,227,0.95,33856
682,6jxcjp,"Had my kayak out for an hour before the rental shop opened. Had the whole lake to myself. 10/10 would paddle again. Lake Louise, AB [OC] [1080x1920]",jtunda,,1498613180.0,https://i.redd.it/2eggngnpfa6z.jpg,,False,,False,,False,False,EarthPorn,False,False,False,493,0.92,33836
683,88qdpo,"Rainbow Falls, Mammoth Mountain on opening Day 2017 after a long winter [OC][3200x4000]",stevenjmagner,,1522584746.0,https://i.redd.it/faptrgzagap01.jpg,,False,,False,,False,False,EarthPorn,False,False,False,311,0.93,33800
684,87mreg,"The towers of Greenland rising through the fog, Greenland [1618 x 1080] © By Max Rive",snowsnothing,,1522189479.0,https://c1.staticflickr.com/1/757/22792566551_ff23233525_o.jpg,,False,,False,,False,False,EarthPorn,False,False,False,260,0.95,33782
685,cw409l,"A misty morning just a few steps from my tent in Banff, Canada. [OC] [1959x2048]",5impl3jack,,1566910244.0,https://i.redd.it/rqs7j264nzi31.jpg,,True,,False,,False,False,EarthPorn,False,False,False,446,0.96,33768
686,g1sdq9,"An Amazing Event at Seljalandsfoss, Iceland. [OC] [1600x2000]",benstrauss,,1586958981.0,https://i.redd.it/qe5ogevamzs41.jpg,,False,,False,,False,False,EarthPorn,False,False,False,239,0.95,33732
687,87dcsc,"Some places can change your life in a moment. Mt Assiniboine Provincial Park, BC, Canada. [OC][1080x1080]",walkingaswind,,1522103541.0,https://i.redd.it/hsnjsbfsp6o01.jpg,,False,,False,,False,False,EarthPorn,False,False,False,401,0.94,33730
688,abmwr6,Found this hidden paradise in Andalusia [3424 × 4001] [OC],malthezimakoff,,1546382711.0,https://i.redd.it/beapu1h54w721.jpg,,True,,False,,False,False,EarthPorn,False,False,False,301,0.95,33704
689,7zeaso,"The sky before sunset at Tre Cime di Lavaredo in the dolomites, South Tyrol, Italy[1600 x 820] © By Carlos F. Turienzo",snowsnothing,,1519299689.0,https://c1.staticflickr.com/5/4702/25522615597_3cfe947ed3_h.jpg,,False,,False,,False,False,EarthPorn,False,False,False,257,0.94,33678
690,60x7be,"People don't really consider beauty of Idaho, so I'm here to share a little love for it. This is Alice Lake in the Sawtooth Wilderness. [2700x1800] [OC]",alido2boord,,1490214565.0,http://i.imgur.com/IUn1qcQ.jpg,,False,,False,,False,False,EarthPorn,False,False,False,1376,0.9,33664
691,8810i8,"A single 31 second exposure I captured of the Galactic Core rising over Banks Lake National Wildlife Refuge in Lanier County Georgia on Thursday, March 22nd at 5:57 A.M. (1459x973) (OC)",,,1522328020.0,https://i.redd.it/r7fzwhz79po01.jpg,,False,,False,,False,False,EarthPorn,False,False,False,428,0.94,33608
692,a08f3j,"View from a back of a dragon. Þakgil, Iceland. [OC][1463x2048]",Sakaarnis,,1543151983.0,https://i.redd.it/prqe4j2b9h021.jpg,,True,,False,,False,False,EarthPorn,False,False,False,188,0.95,33606
693,5jqgyz,"Tatra Mountains, Poland by Pawel Uchorczak [1024x972]",Reza_Pahlavi,,1482411972.0,"http://bi.gazeta.pl/im/d5/2c/14/z21152725IH,Widok-na-Tatry-z-niewielkiej-wsi-Lapszanka.jpg",,False,,False,,False,False,EarthPorn,False,False,False,334,0.91,33600
694,jbvdiy,"Sometimes you get really lucky with sunset light, Tre Cime di Lavaredo, Italy [OC][1597x2500]",armitage2112,,1602792984.0,https://i.redd.it/rgc91eptgbt51.jpg,,False,,False,,False,False,EarthPorn,False,False,False,387,0.96,33602
695,adlccs,"A literal explosion of colour, Strokkur, Iceland [3734 × 6000] [OC]",Brightersid3,,1546890189.0,https://i.redd.it/fm1dxp7m02921.jpg,,True,,False,,False,False,EarthPorn,False,False,False,333,0.95,33592
696,hjl5gg,Antarctica. Found the ice dragon. [3024x4032][OC],thomasoberlin,,1593644109.0,https://i.redd.it/w8aixn4msb851.jpg,,False,,False,,False,False,EarthPorn,False,False,False,281,0.96,33585
697,91u44x,"White Sands, NM. Waking up at 2 a.m. here is worth it as you can see this with the bare eye. [3278x4912][OC]",openairphotography,,1532541164.0,https://i.redd.it/1bcgv0c4t4c11.jpg,,True,,False,,False,False,EarthPorn,False,False,False,569,0.91,33587
698,cb2zuq,Here is my attempt to recreate windows XP wallpaper. Shot in Teton valley. [OC] [7984x4491],Latro0,,1562689094.0,https://i.redd.it/o8tpp2ufza931.jpg,,True,,False,,False,False,EarthPorn,False,False,False,435,0.96,33560
699,fpj3cf,"Fairy pools, Scotland, summer. 3200x2600. [oc]",minas000,,1585254839.0,https://i.redd.it/r5nxyz10v2p41.jpg,,False,,False,,False,False,EarthPorn,False,False,False,267,0.96,33524
700,70dydl,"Taken on my trip on the John Muir Trail a few months ago. Bullfrog Lake, Kings Canyon National Park, California [OC] [3024 × 4032]",Wee_Ninja,,1505522489.0,https://i.redd.it/w8mdg7hb55mz.jpg,,False,,False,,False,False,EarthPorn,False,False,False,292,0.93,33528
701,6wyofc,"Lake in Tatra Mountains Poland, taken yesterday after 6h hiking [OC] [5864x3909]",x-o-x-o-x,,1504094772.0,https://i.redd.it/fderuqz78viz.jpg,,False,,False,,False,False,EarthPorn,False,False,False,393,0.93,33532
702,9aftgq,"Got off the plane, checked in at my hotel and then shot this few hours later. Perfect nocturnal welcome gift! Then almost struck a moose on the way back. Watch out on those roads! Nordland (Norway) [OC] [1080x1350]",felizuko,,1535292907.0,https://i.redd.it/4ebo35kt3gi11.jpg,,True,,False,,False,False,EarthPorn,False,False,False,280,0.93,33519
703,9gx7x1,"I checked ""hike in the Bernese Alps"" off my bucket list - Here's Lauterbrunnen Valley [4000x2668]",Livid_Narwhal,,1537293983.0,https://i.redd.it/r1q7gpgcd1n11.jpg,,True,,False,,False,False,EarthPorn,False,False,False,295,0.95,33482
704,e1qdzz,A rainy morning in the Grand Tetons [OC] [3648 x 4864] - @codymayer22,Codymayer22,,1574731202.0,https://i.redd.it/tfmoz6tnmx041.jpg,,True,,False,,False,False,EarthPorn,False,False,False,206,0.96,33469
705,99wqj8,"Glen coe, Scotland. No this is not a painting. [960x720]",divinityturtle,,1535111409.0,https://i.redd.it/kub4puvu41i11.jpg,OC,False,,False,,False,False,EarthPorn,False,False,False,502,0.91,33468
706,6weolo,"My Dad was very excited to share this photo with me. Pulled over to take it while on a business trip. Bow Lake, Alberta [3264x2448] [OC]",PeteRich,,1503867027.0,https://i.redd.it/jt5r86n7fciz.jpg,,False,,False,,False,False,EarthPorn,False,False,False,305,0.93,33466
707,k7uw6r,"Welcome to the jungle. Laurisilva Forest, Madeira [OC][1280x853]",untitledshot,,1607265717.0,https://i.redd.it/4s213u2nwk361.jpg,,False,,False,,False,False,EarthPorn,False,False,False,261,0.96,33433
708,l1ke92,"I was hiking alone and got scared by howling coyotes, but I still got the pic! Antelope Island, Utah, USA [OC][3966x5000] by @hansiphoto",hansiphoto,,1611182193.0,https://i.imgur.com/zlCram7.jpg,,False,,False,,False,False,EarthPorn,False,False,False,519,0.94,33422
709,6fxssj,All of the snow in the Sierras this last winter has created some incredible conditions in Yosemite now that the snow is melting [OC][2970x4455],Dyatlovpass,,1496884539.0,http://i.imgur.com/h9gvh7M.jpg,,False,,False,,False,False,EarthPorn,False,False,False,279,0.94,33381
710,6pn9u7,"""The Pool"", Jotunheimen, Norway. 1800 above sea level. [2049 × 2346]",SwedishPotit,,1501066740.0,https://i.redd.it/ygwmldd44xbz.jpg,OC,False,,False,,False,False,EarthPorn,False,False,False,526,0.93,33364
711,5w3qwx,"Nowhere special. Local Beauty - Huncote,Leicestershire, UK. We often overlook what's on our doorstep. [OC] [3513*5270]",hamjamham,,1488023464.0,http://imgur.com/drxMxT5,,False,,False,,False,False,EarthPorn,False,False,False,581,0.91,33350
712,90kzlr,Ended up getting a perfect shot of the Grand Tetons in Wyoming [OC] [6000x4000],plowkiller,,1532130452.0,https://i.redd.it/0ybcjgucw6b11.jpg,,True,,False,,False,False,EarthPorn,False,False,False,388,0.92,33327
713,hizib7,"This magical little tarn only appears after extended rainfall and melting of snow. The last time it appeared before now was in 2018. The vibrant colour of the water is said to be caused by the sediments from the rocks below. Tasmania, Australia. 3815x5576 (OC)",colours_of_summer_,,1593562152.0,https://i.redd.it/8kyycwgu05851.jpg,,False,,False,,False,False,EarthPorn,False,False,False,384,0.97,33318
714,ezquh3,"First light hitting the valley of Alpe di Siusi in the Dolomites, Italy [1670x2150] [OC]",jetclarke,,1580987170.0,https://i.redd.it/iphf7rwycaf41.jpg,,True,,False,,False,False,EarthPorn,False,False,False,224,0.97,33291
715,ds4g3d,Aurora over the mighty Skogafoss in Iceland [OC] [3430x5208],thomyorkeftw,📷,1572983230.0,https://i.redd.it/6xpze6g09xw31.jpg,,True,,False,,False,False,EarthPorn,False,False,False,219,0.96,33273
716,o9kkbo,"Where heaven and Earth meet (Grand Teton, WY) [OC] 3000 x 3000",sg3707, .,1624887914.0,https://i.redd.it/k386vsshg0871.jpg,,False,,False,,False,False,EarthPorn,False,False,False,228,0.94,33260
717,fk3919,"This photo is upside down. The clearest reflection I've ever seen, zoom in for details. Lago di Carezza, Italy [1800x2250] [OC]",jetclarke,,1584442402.0,https://i.redd.it/q815f4j0r7n41.jpg,,True,,False,,False,False,EarthPorn,False,False,False,247,0.93,33252
718,5zjm93,"My friend and I hiked in to spend the night in Boca Cave. In the morning we woke up to a very dense fog obscuring everything. However, for a brief moment, it lifted and we got to see this sunrise. A very memorable camping trip. [OC][1638x2038]",robybabcock,,1489587731.0,https://i.redd.it/g29wcv2oykly.jpg,,False,,False,,False,False,EarthPorn,False,False,False,413,0.88,33254
719,i049bd,"Magical Golden Hour, Shropshire, England [OC] [5196 x 3907]",-camtheron-,,1596042281.0,https://i.redd.it/pnvpgsclvtd51.jpg,,False,,False,,False,False,EarthPorn,False,False,False,258,0.97,33245
720,86g0r1,Surreal Alpenglow on Mount Washington at sunset in New Hampshire [OC] [3648x4560],jevanleith,,1521760190.0,https://i.redd.it/5qmh3c3fben01.png,,False,,False,,False,False,EarthPorn,False,False,False,302,0.94,33231
721,862iao,"Winter Waterfall in the Oregon Wilderness {2500,2500} (OC)",NIXON-Photography,,1521642656.0,https://i.redd.it/ekrfptn2n4n01.jpg,[1667x2500],False,,False,,False,False,EarthPorn,False,False,False,474,0.94,33227
722,8x02e9,"Looks like a painting. Fjadrargljufur Canyon, Iceland [3024x3024] [OC]",loftybirdman,,1531036763.0,https://i.redd.it/gts3hp4uko811.jpg,,True,,False,,False,False,EarthPorn,False,False,False,261,0.95,33218
723,9horyp,"Farewell Yosemite, CA [OC] [1280x1920]",banditowhiskey,,1537529298.0,https://i.imgur.com/IofSVCm.jpg,,True,,False,,False,False,EarthPorn,False,False,False,264,0.95,33205
724,fkc9zo,"I waded through 3KM's of canyon and smashed my kneecaps on a rock in the water trying to save my camera after I slipped over. Martvili, Georgia [OC] [3968 × 4960]",aydin_h,,1584476321.0,https://i.redd.it/7ppsrg27jan41.jpg,,True,,False,,False,False,EarthPorn,False,False,False,478,0.9,33201
725,lv9g93,"A Hiker’s Paradise, Colorado Rockies. [OC] [1280x1600]",benstrauss,,1614605986.0,https://i.redd.it/s09aprb17fk61.jpg,,False,,False,,False,False,EarthPorn,False,False,False,255,0.96,33203
726,6ce6oz,"I hear we are doing Lake Tahoe today? Here is Secret Cove, on the Nevada-side of the lake [OC] [6000x4000]",DBer321,,1495332422.0,https://i.redd.it/x360kt5ahryy.jpg,,False,,False,,False,False,EarthPorn,False,False,False,481,0.91,33200
727,4xg9ek,Layers of Colorado [OC] [3639x4853],razzledazzle125,,1471041384.0,http://imgur.com/mswo7eZ,,False,,False,,False,False,EarthPorn,False,False,False,639,0.89,33184
728,7bt4qa,"Vivid autumn leaves reflecting in a lake in La Maurice National Park, Quebec, Canada. By Tracy Munson [2048 x 1367]",ASAmd,,1510232302.0,https://c1.staticflickr.com/5/4569/38215098956_329ee2478c_k.jpg,,False,,False,,False,False,EarthPorn,False,False,False,414,0.93,33156
729,8cvzqu,"Pu'u Kukui peak engulfed in storm clouds, West Maui Mountains, Hawaii [OC][1500x1875]",AndrewHelmer,📷,1523966657.0,http://www.andrewhelmer.com/s/PuuKukui-1500px.jpg,,False,,False,,False,False,EarthPorn,False,False,False,272,0.94,33117
730,a0ydhx,"Mid-Summer Blue Hour on Mount Rainier, Washington [OC][3200x4000]",billinate,,1543348603.0,https://i.redd.it/r4sydkpthx021.jpg,,True,,False,,False,False,EarthPorn,False,False,False,142,0.95,33112
731,bhgl85,"They say 4/20 is a special day in Colorado - this year, the sky joined in. Saturday's sunrise from 11,000 feet in Rocky Mountain National Park [OC][1400x2100]",mtuohyphoto,,1556242109.0,https://i.redd.it/b1sq37sygiu21.jpg,,True,,False,,False,False,EarthPorn,False,False,False,332,0.92,33110
732,853lnc,"The Milky Way setting during blue hour over the Allegheny Mountains, WV [OC][2048x1365]",DanielJStein,,1521291906.0,https://i.imgur.com/eNo8pux.jpg,,False,,False,,False,False,EarthPorn,False,False,False,271,0.92,33101
733,5t3ujh,"I stood here for hours and watched the lava form a new coastline. It was amazing. Hawaii, USA [OC][4000x6000]",hansiphoto,,1486684231.0,http://imgur.com/wNAyZox,,False,,False,,False,False,EarthPorn,False,False,False,496,0.93,33077
734,eq1n60,"Waited for three hours in the wind and rain for the clouds to lift from these peaks. Worth every shivering second. Torres Sur, Torre Central, Torre Norte. Torres del Paine, Chile. [3024x3924] [OC]",imsquare177,,1579274170.0,https://i.redd.it/bpp8ve7evcb41.jpg,,True,,False,,False,False,EarthPorn,False,False,False,284,0.92,33078
735,kls21h,Winter sunrise reflections in Colorado. OC [2457x3071],ConnorScalbom,,1609167753.0,https://i.redd.it/hsv7iygd0y761.jpg,,False,,False,,False,False,EarthPorn,False,False,False,193,0.95,33072
736,e41rkb,"These are actually two icebergs that transformed into a brilliant blue shade as the light changed that evening in Ilulissat, Greenland [OC] [6000x4000]",icebergchick,📷,1575141481.0,https://i.redd.it/6xbypoweiv141.jpg,BestOf 2019 Winner,True,,False,,False,False,EarthPorn,False,False,False,155,0.96,33069
