,id,title,author,author_flair_text,created_at,url,flair,is_original_content,distinguished,is_self,selftext,is_spoiler,is_over_18,subreddit,is_stickied,is_edited,is_locked,num_comments,upvote_ratio,score
1,7t0swm,"So glad I got up for this -15°F sunrise. There's only a handful of days in the year where the morning light lines up perfectly with the hole in Hollow Rock. Grand Portage, MN. [5287×6995] [OC]",Tuckerolson,,1516926839.0,https://i.redd.it/5hv4l3032bc01.jpg,[5287x6995],False,,False,,False,False,EarthPorn,False,False,False,1545,0.93,104298
2,6t89rv,"For a 15-minute period during my flight back to Canada yesterday, there were no clouds blocking the view over Greenland's glaciers and icebergs [3264x1754] [OC]",lostcanuck,,1502542338.0,http://i.imgur.com/wVpIicX.jpg,,False,,False,,False,False,EarthPorn,False,False,False,796,0.95,90465
3,8e4djh,"Woke up at 5AM to catch the tulips with morning mist, the Netherlands (OC)[1920x1280]",cryptodesign,,1524415000.0,https://i.redd.it/g5g7mtzvmht01.jpg,,False,,False,,False,False,EarthPorn,False,False,False,793,0.94,88648
4,cshcdu,"You might have seen it before, but here's that one place in Indonesia with a volcano behind waterfalls. [4472 × 5590] [OC]",malthezimakoff,,1566222621.0,https://i.redd.it/qqgds2i3ueh31.jpg,,True,,False,,False,False,EarthPorn,False,False,False,1012,0.95,84805
5,6vkdh8,"Eclipse Phases over Brasstown Bald, Georgia [OC] [2048x1365]",nevernudedude,,1503507941.0,https://i.redd.it/9d9w6pkirihz.jpg,,False,,False,,False,False,EarthPorn,False,False,False,871,0.78,84214
6,8qijnj,One of my scariest moments as a photographer- what you dont see here is the 100m drop in front of me and the gale force wind from behind. Two minutes of light and then it was dark again. Faroe islands [OC] [4000x2444],felizuko,,1528806669.0,https://i.redd.it/ipda90h8dk311.jpg,BestOf 2018 Winner,False,,False,,False,False,EarthPorn,False,False,False,785,0.92,83866
7,q174nw,It took me 3 years to get a permit to visit this surreal rock formation called the Wave in Arizona - it was worth it! [2000x2500][OC],mrcnzajac,,1633359627.0,https://i.redd.it/0d7suesf6gr71.jpg,,False,,False,,False,False,EarthPorn,False,False,False,1499,0.95,82114
8,5ut3iq,I recently moved to Alaska from Texas. It's a bit different here. [OC] [1536x1920],aatdalt,,1487434136.0,https://i.redd.it/mfqm1x49akgy.jpg,,False,,False,,False,False,EarthPorn,False,False,False,1988,0.94,76576
9,diybaq,"After waiting out a major blizzard in Montana, was treated to one of the best sunset views I can imagine. Glacier National Park, Montana. [OC][1920x2400]",Nateloobz,,1571271177.0,https://i.redd.it/lntb7cl5uzs31.jpg,,True,,False,,False,False,EarthPorn,False,False,False,802,0.96,74722
10,6z2jw7,"Probably the easiest shot you can take in Zion and arguably the best spot! Zion National Park, [OC] [1365x2048]",gurungp,,1504973686.0,https://i.redd.it/jh0gfb3ktvkz.jpg,,False,,False,,False,False,EarthPorn,False,False,False,806,0.94,73462
11,bxg3vw,"Mother Nature’s color palette is incredible. Broome, Western Australia [OC] [1080x1350]",ryanchatfieldimages,📷,1559823801.0,https://i.redd.it/6u7sat5hbq231.jpg,BestOf 2019 Winner,True,,False,,False,False,EarthPorn,False,False,False,525,0.96,72193
12,6k91xp,"A rare cloud inversion during sunrise at Mt St Helens, Washington (OC)[1335x2000] @rosssvhphoto",celica90,,1498749898.0,http://imgur.com/ppqan5G,OC,False,,False,,False,False,EarthPorn,False,False,False,580,0.94,71318
13,idknxu,"Caught this incredible exploding meteor when I went to Rattlesnake Lake in Washington, USA last weekend. Zoom in to see the exact moment it explodes in two. [OC] [3300 x 4960]",chaibhu,,1597963362.0,https://i.redd.it/hih7e69nj8i51.jpg,,False,,False,,False,False,EarthPorn,False,False,False,1112,0.97,69879
14,7uj64r,"The sky was just clear enough to watch the Blue Blood Moon over the peaks of Vancouver Island, BC [OC][2300x1533]",Jacobklassen,,1517496236.0,https://i.redd.it/leu85shw5md01.jpg,,False,,False,,False,False,EarthPorn,False,False,False,589,0.95,69625
15,8ddefa,Captured Poseidon's Trident rising out of Strokkur Geyser in Iceland [OC][2133x3200],walkslowrunwild,,1524130352.0,https://i.redd.it/4itnc1ff4us01.jpg,,False,,False,,False,False,EarthPorn,False,False,False,603,0.94,69435
16,5to443,"I hiked alone all day, ran away from two moose, and took a picture of the most amazing view from the summit. Alta, Utah, USA [OC][4000x6000]",hansiphoto,,1486932739.0,http://imgur.com/lprvIce,,False,,False,,False,False,EarthPorn,False,False,False,1119,0.9,68798
17,8080ml,"Best waterfalls in the states? Oregon, in my opinion.. [OC] [2400 x 3000]",nathanielthewise,,1519597529.0,https://i.redd.it/v95w1pywpfi01.jpg,BestOf 2018 Winner,False,,False,,False,False,EarthPorn,False,False,False,1111,0.92,68436
18,6vz211,"What the horizon looked like in all directions during the eclipse, from a mountaintop in the Smokies of Tennessee [OC][3000x2000]",,,1503673603.0,https://c1.staticflickr.com/5/4403/36388952880_c9d523338f_o.jpg,,False,,False,,False,False,EarthPorn,False,False,False,550,0.93,68407
19,7uwy72,"Got dumped, so I backpacked Hawaii for a month. Best decision ever. Kalalau Trail - Kaua’i [OC] [1536x1024]",Broxygen,,1517628864.0,https://i.redd.it/szqeea294xd01.jpg,[3264x2448],False,,False,,False,False,EarthPorn,False,False,False,1776,0.88,68340
20,72cm1f,Mount St. Helens peaking above beautiful wildflowers and thick fog [OC] [1438x200],steveschwindt,,1506348208.0,https://i.redd.it/9i1bnqswc1oz.jpg,,False,,False,,False,False,EarthPorn,False,False,False,460,0.93,67678
21,luhzvc,It took an entire day searching for a single formation but I finally found the Alien Throne in New Mexico’s badlands. [OC] [4016X6016] IG @danielbenjaminphoto,danielbenjaminphoto,,1614524470.0,https://i.redd.it/zh1g6g1mg8k61.jpg,,False,,False,,False,False,EarthPorn,False,False,False,851,0.93,67494
22,6rqst0,"I could talk about how I hiked 100 miles in Iceland, but the best photo I took was only a 2-minute walk from the parking lot! [OC] [8000x5000)",JoshuaSortino,,1501923342.0,http://i.imgur.com/CS8QhJG.jpg,,False,,False,,False,False,EarthPorn,False,False,False,597,0.91,67262
23,91c4x3,"The triplet, Yosemite national Park [4000x5000] [OC]",jamesliuu,,1532388458.0,https://i.redd.it/de9tgpj48sb11.jpg,,True,,False,,False,False,EarthPorn,False,False,False,809,0.93,67221
24,anpzex,The last couple of days have been so cold but so beautiful! Finland [@niiloi][1080x1350],ASAmd,,1549454234.0,https://instagram.fdel1-4.fna.fbcdn.net/vp/eb4fc93b6cbee8b4ca51b1480e80b2a3/5CF77324/t51.2885-15/e35/49548302_343734369566966_4155702392958220670_n.jpg?_nc_ht=instagram.fdel1-4.fna.fbcdn.net,,False,,False,,False,False,EarthPorn,False,False,False,484,0.93,66379
25,fcb1n7,Easily my favorite shot from my trip to Canada last summer. Taken at Athabasca Falls. [OC] [3213x4016],stillbornfox,,1583150503.0,https://i.imgur.com/B6HPXkk.jpg,,True,,False,,False,False,EarthPorn,False,False,False,690,0.96,66125
26,6sa8bf,"Avatar Mountains - Zhangjiajie, China - Also known as inspiration for Pandora P.S The echo here is incredible [OC] [1080 x 1350]",ahhlew,,1502155841.0,https://i.redd.it/a3ye33532fez.jpg,,False,,False,,False,False,EarthPorn,False,False,False,1067,0.91,65441
27,fj0n65,"I have shared plenty of Korean pine trees, but without a doubt this is my new favorite one, Jeolla bukdo, South Korea [OC] [3000x2000]",NathanielMerz,📷,1584275460.0,https://i.redd.it/eodk675sytm41.jpg,,True,,False,,False,False,EarthPorn,False,False,False,295,0.96,65003
28,6t5ekm,"My dad is super proud of this picture and says it's the best one he has ever taken. The Königssee in Berchtesgaden, Germany. [640 x 480]",Thinker_Belle,,1502498472.0,http://imgur.com/7PlPaTg,,False,,False,,False,False,EarthPorn,False,False,False,734,0.85,64847
29,d74w1h,"Typically, I’m annoyed of flights getting delayed, on this occasion not so as 31 mins of delay caused my flight to flew by Mount Rainier, Washington around golden hour.[OC] [3549x2366]",ExposureSetLong,,1569033227.0,https://i.imgur.com/H5k6AOa.jpg,,True,,False,,False,False,EarthPorn,False,False,False,504,0.94,64803
30,ih3yvc,"I've been trying to get this shot for four years...last week, everything finally came together while backpacking around Mt Baker (OC) [800x1200] @ross_schram",debuggerfly,,1598465221.0,https://i.redd.it/59lgw7110ej51.jpg,,False,,False,,False,False,EarthPorn,False,False,False,414,0.95,64610
31,78l06q,"Welcome to my favorite view on earth, Mt. Assiniboine Provincial Park, Canada [OC] (1080X864)",walkingaswind,,1508900902.0,https://i.redd.it/51btvwb37wtz.jpg,,False,,False,,False,False,EarthPorn,False,False,False,961,0.94,64194
32,8pohoo,"A year ago I haven't even heard of this place, now I am here thanks to Reddit. Cadlao Island, Palawan, Philippines. [OC][864x1080]",etunar,,1528499320.0,https://i.redd.it/ulx6dwz9yu211.jpg,/r/all,False,,False,,False,False,EarthPorn,False,False,False,664,0.92,63813
33,7v3sxj,First snow in Yosemite. El Capitan getting lit up just before the sunsets. [oc] 3000x4000,WaterProject,,1517708925.0,https://i.redd.it/zk4vozzbq3e01.jpg,[1586x1982],False,,False,,False,False,EarthPorn,False,False,False,578,0.91,63327
34,nubxr0,"It's a little unnerving when you wake up in the morning and find these right outside your tent... - Gates of the Arctic National Park, Alaska [OC][1335x2000] @mattymeis",mattymeis,,1623070803.0,https://i.redd.it/c5241r01du371.jpg,,False,,False,,False,False,EarthPorn,False,False,False,1271,0.9,62984
35,a7nlfw,Our Honeymoon trek earlier this month in Torres Del Paine - Chile [1080 × 1350],benziin,,1545234714.0,https://i.redd.it/94ag9s64a9521.jpg,,False,,False,,False,False,EarthPorn,False,False,False,583,0.94,62614
36,779mrp,"When my sunrise alarm went off I heard rain coming down on my tent and I almost went back to sleep but I decided to peak outside anyway and I witnessed the best sunrise I've ever seen. (Tombstone Territorial Park, YT, CA) [2500x1406][OC]",aryeh95, .,1508360417.0,https://i.imgur.com/Kt0jUHf.jpg,,False,,False,,False,False,EarthPorn,False,False,False,406,0.91,61964
37,7nf71w,"Panorama Trail, Yosemite National Park [OC][3648×5472]",franklinsteinnn,,1514814355.0,https://i.redd.it/2ajqaz8qmg701.jpg,,False,,False,,False,False,EarthPorn,False,False,False,868,0.93,61702
38,7be2y0,A long exposure in pitch black darkness reveals the moody side of Haukland beach (Lofoten) in Norway [OC] [1449x2000],felizuko,,1510070365.0,https://i.redd.it/jxfvdc5eskwz.jpg,,False,,False,,False,False,EarthPorn,False,False,False,1214,0.93,61612
39,6o3yy3,"China is a truly underrated country in terms of natural beauty. This was taken in Yangshou, China [OC] [5300 × 4000]",jordansw,,1500413964.0,https://i.redd.it/d9ejxzs27faz.jpg,,False,,False,,False,False,EarthPorn,False,False,False,1665,0.85,61480
40,7t9yht,My first time ever visiting Yosemite was this fall [OC][1925x1540],ababsy,,1517023122.0,https://i.redd.it/deyr3lnw2jc01.jpg,,False,,False,,False,False,EarthPorn,False,False,False,666,0.92,61455
41,91hbyh,"I took this shot last year with a broken lens and bad techniques. Re-visited with better techniques and working gear. This is the result! Downeast, Maine [OC][1367x2048]",ilikefishwaytoomuch,,1532438462.0,https://i.redd.it/n5o4dhcecwb11.jpg,,True,,False,,False,False,EarthPorn,False,False,False,809,0.92,61347
42,7w9xek,"People said to stop with the Utah pictures, so here is Waimea Bay, Hawaii [OC] 4472X3578",NoneOfYourSacrifices,,1518139658.0,https://i.redd.it/jgqsxk54b3f01.jpg,,False,,False,,False,False,EarthPorn,False,False,False,744,0.9,61157
43,a6v8gs,"Mount Hood, Mount Rainier, and St. Helens in the same picture🏔 [OC] [810x1080]",masterofhalo08,,1545011107.0,https://i.redd.it/bzp1kboqtq421.jpg,Mt. Adams NOT St. Helens,True,,False,,False,False,EarthPorn,False,False,False,1025,0.91,61034
44,9pjg80,"My first attempt at minimalism in my landscape photography at White Sand, NM [OC][1333x2000]",Awayiflew,,1539952954.0,https://i.redd.it/fbtwq6b115t11.jpg,,True,,False,,False,False,EarthPorn,False,False,False,1244,0.92,60544
45,fabd1h,"The Witch tree, running for European Tree of the year, the Netherlands [1080x1514] [OC]",Robvisserphotography,,1582806452.0,https://i.redd.it/gfcwdpyomgj41.jpg,,True,,False,,False,False,EarthPorn,False,False,False,784,0.96,60268
46,5ceg1q,Friend told me my Tree from the Gods picture will be appreciated in Earth Porn. Vermont. [OC] [3024 × 4032],LeGaffe,,1478870524.0,https://i.redd.it/tp5cy3qorzwx.jpg,,False,,False,,False,False,EarthPorn,False,False,False,647,0.9,60058
47,cua2wb,"Blue lava erupting from the Kawah Ijen volcano in Indonesia. The mountain contains large amounts of pure sulfur, which emit icy violet colors as it burns. | by Olivier Grunewald [2048 × 1362]",mossberg91,📷,1566542331.0,https://www.nationalgeographic.com/content/dam/news/photos/000/758/75879.jpg,"Dallol vulcano, Ethiopia",False,,False,,False,False,EarthPorn,False,False,False,441,0.96,59514
48,a9pfbd,"Starting my NY2019 Resolution Early by Taking More Pictures. Banff, Canada [OC] [2500x3750]",nfordhk,,1545838123.0,https://i.redd.it/72gujosn4n621.jpg,,True,,False,,False,False,EarthPorn,False,False,False,499,0.92,59469
49,8ls795,Oregon Coast. [3780x5102] [OC],zjpurdy,,1527164472.0,https://i.redd.it/r9hvv8oiqsz01.jpg,/r/all,False,,False,,False,False,EarthPorn,False,False,False,1150,0.94,59265
50,5yzbkt,"Clearing fog reveals vibrant wildflowers on a beautiful morning near Mount St. Helens, Washington [OC] [1572x2000]",steveschwindt,,1489334475.0,https://i.redd.it/i585l9uh20ly.jpg,,False,,False,,False,False,EarthPorn,False,False,False,364,0.93,58913
51,f19z5h,"The most beautiful sunrise I’ve photographed, Rocky Mountains, Colorado. [OC] [1280x1600]",benstrauss,,1581261597.0,https://i.redd.it/6ey749s11xf41.jpg,,True,,False,,False,False,EarthPorn,False,False,False,379,0.95,58728
52,7ao8ub,"Its alright to stand out in a crowd. The Enchantments, Washington [OC] [2275x2844]",Elliothawkey,,1509763620.0,https://i.redd.it/iu90dye8gvvz.jpg,,False,,False,,False,False,EarthPorn,False,False,False,825,0.92,58487
53,91mm7e,"Tranquility, Death Valley National Park [1080x1350][OC]",jamesliuu,,1532475472.0,https://i.redd.it/96okrm0qezb11.jpg,,True,,False,,False,False,EarthPorn,False,False,False,668,0.95,58406
54,7x0oh9,Reflecting in Yosemite [OC][3648×5472],franklinsteinnn,,1518441758.0,https://i.redd.it/vhtthbh49sf01.jpg,,False,,False,,False,False,EarthPorn,False,False,False,478,0.94,58241
55,e4z9r0,Rebooked my train ticket from Paris to be back home in the Netherlands earlier because good conditions were predicted. I was not disappointed. (1920x1280)[OC],cryptodesign,,1575294224.0,https://i.redd.it/0245w5tp48241.jpg,,True,,False,,False,False,EarthPorn,False,False,False,480,0.94,57331
56,5ym0b9,"The moment my jaw dropped. Napali Coast, Kauai, Hawaii [OC] [3000x2002]",jnlsgrc,,1489152026.0,http://i.imgur.com/SIk9LkV.jpg,,False,,False,,False,False,EarthPorn,False,False,False,1185,0.9,56981
57,yscr89,"[OC][2180x1080] 4 years ago today I took my favorite photo ever of a drained cypress lake at George L. Smith State Park in Georgia, USA",grabmysquatch,,1668178419.0,https://i.redd.it/xy5di62e5cz91.jpg,,False,,False,,False,False,EarthPorn,False,False,False,382,0.96,56795
58,a4qm1f,Layers for days at Mount Rainier National Park [1600x2000][OC],jakegoslinephoto,,1544402613.0,https://i.redd.it/bpajt7sbkc321.jpg,,True,,False,,False,False,EarthPorn,False,False,False,412,0.94,56720
59,7pgbn3,"The break of dawn in Yosemite National Park, California. [OC] (5000x4000)",erubes1,,1515598540.0,https://i.redd.it/66hh06k2f9901.jpg,[3276x4096],False,,False,,False,False,EarthPorn,False,False,False,426,0.93,56499
60,e2l2sf,I caught a photo of 3 levels of mountain lakes while visiting Lofoten (Norway) [OC] [3276 × 4096],malthezimakoff,,1574882176.0,https://i.redd.it/roao4hrf3a141.jpg,,True,,False,,False,False,EarthPorn,False,False,False,462,0.96,56262
61,9z3bn9,Rare conditions finally lined up at Mt Baker for me to get a shot I've been envisioning for years (OC) [1335x2000] @rosssvhphoto,debuggerfly,,1542807851.0,https://i.redd.it/0u1u2m73uoz11.jpg,,True,,False,,False,False,EarthPorn,False,False,False,420,0.94,56238
62,6thuhc,"Happy 150th Canada, you're looking great for your age. Yours truly, a secret admirer. - Lake Moraine [OC] [2048 x 1536]",DestinSparks,,1502659165.0,https://i.redd.it/16dldknomkfz.jpg,,False,,False,,False,False,EarthPorn,False,False,False,797,0.88,55666
63,7cvt67,"I lost my wallet this evening, but hey got a nice fall sunset at Zion National Park [OC][1335x2000]",mattymeis,,1510668535.0,https://i.redd.it/49b5u1zf7yxz.jpg,,False,,False,,False,False,EarthPorn,False,False,False,926,0.88,55150
64,8rqyco,"One of the best light shows I've seen at ramona falls, OR [1336x2000][oc]",Awayiflew,,1529241378.0,https://i.redd.it/mjwylkc2ak411.jpg,/r/all,True,,False,,False,False,EarthPorn,False,False,False,799,0.91,55134
65,cx05ni,"The most perfect beach, Esperance, Western Australia [2778 x 3472][OC]",jaxon_roberts,📷,1567081357.0,https://i.redd.it/gzneb2bgrdj31.jpg,,True,,False,,False,False,EarthPorn,False,False,False,707,0.95,55094
66,9scs9r,Do you see her? Got really lucky with shadows in New Mexico [OC][1541x2300],Awayiflew,,1540817448.0,https://i.redd.it/69uco28wd4v11.jpg,,True,,False,,False,False,EarthPorn,False,False,False,811,0.93,55004
67,b5g074,"Quite possibly the most beautiful morning of my life. Mount Hood, Oregon [OC] [4000 x 3200]",nathanielthewise,,1553546036.0,https://i.redd.it/nahhvcadsbo21.jpg,,True,,False,,False,False,EarthPorn,False,False,False,423,0.95,54893
68,9kwgq2,Fall in Alaska [OC][4443x5554],bdorts,,1538528225.0,https://i.redd.it/3lnp50qscvp11.jpg,,True,,False,,False,False,EarthPorn,False,False,False,461,0.94,54807
69,dzjsqg,"Zion’s gold, I immediately jumped out of my car during our road trip to catch this moment in Zion National park [1637x1080] [OC]",Robvisserphotography,,1574345264.0,https://i.redd.it/y3dh65c8r1041.jpg,,True,,False,,False,False,EarthPorn,False,False,False,684,0.93,54649
70,9zh9x8,"I sat and waited for 3 hours at -7°C for the clouds to clear for this. Matterhorn, Swiss Alps [OC][6000x3375]",Kharenis,,1542916147.0,https://i.redd.it/a7kby8e3sxz11.jpg,,True,,False,,False,False,EarthPorn,False,False,False,812,0.86,54625
71,836t67,I was one of two people who got to witness the surf from yesterday's nor'easter hit the shores of Acadia National Park. [OC][1622x2048],ilikefishwaytoomuch,,1520603608.0,https://i.redd.it/t5r6wcrzsqk01.jpg,,False,,False,,False,False,EarthPorn,False,False,False,597,0.91,54334
72,70msaa,Underwater waterfall illusion in South-West Mauritius [OC] [3311x2128],jjjjjjjjapie,,1505644555.0,https://i.imgur.com/YcYOIm5.jpg,,False,,False,,False,False,EarthPorn,False,False,False,610,0.91,53930
73,6olnx3,"I woke up at 3am to secure a spot to get this shot from the top of 相公mountain, Guilin, China. [oc] 2048*970",roxasimba,,1500611030.0,https://i.redd.it/godb3yiihvaz.jpg,,False,,False,,False,False,EarthPorn,False,False,False,975,0.85,53653
74,8twfqp,Taking this photo didn't feel real. This is NZ. [OC] [2500x1667],nfordhk,,1529980695.0,https://i.redd.it/coeoi6llc9611.jpg,,True,,False,,False,False,EarthPorn,False,False,False,770,0.93,53345
75,7ry8ut,"The Most Beautiful Mountain in the Himalayas - Ama Dablam, Nepal. 6,812m. [OC] (3456 X 3094)",ilostmyselfuk,,1516548240.0,https://i.redd.it/mcljmha8ufb01.jpg,,False,,False,,False,False,EarthPorn,False,False,False,643,0.91,53332
76,7agtf6,Going to Yosemite is always a treat [4223x2821][OC],khanhchu,,1509679108.0,https://i.redd.it/bdh3zugihovz.jpg,,False,,False,,False,False,EarthPorn,False,False,False,536,0.92,53248
77,y07wro,"Pineapple plantation, Maui, Hawaii, USA, [OC], [3024 x 4032]",treywhitaker, .,1665384876.0,https://i.redd.it/475oticqexs91.jpg,,False,,False,,False,False,EarthPorn,False,False,False,828,0.95,52835
78,7e9gpy,As far as the eye can see. Dyrholaey Iceland. [3601x4646][OC],Slam-Cannon,,1511190489.0,https://i.redd.it/nppva79db5zz.jpg,,False,,False,,False,False,EarthPorn,False,False,False,1104,0.93,52804
79,6a2531,My brother is backpacking in the Swiss Alps and he sent me this picture today (3264x2448),Astrophy058,,1494290186.0,https://cdn.discordapp.com/attachments/141691818440916992/311092056489459713/image.jpg,,False,,False,,False,False,EarthPorn,False,False,False,790,0.89,52739
80,71ybe0,Layers on layers seen hiking around Mt Rainier (OC) [1600x2000],ross-svh-photo,,1506173978.0,https://i.redd.it/dajlzyb0zmnz.jpg,,False,,False,,False,False,EarthPorn,False,False,False,321,0.93,52671
81,6q3u4d,Probably the most visually stimulating hike I've ever done: Pacific Crest Trail near Mount Hood [OC][3000x2000],,,1501249076.0,https://i.redd.it/nt7hai6h6ccz.jpg,[3000x2001],False,,False,,False,False,EarthPorn,False,False,False,564,0.91,52651
82,5zfgjz,"It might be just me, but I'm getting kind of tired of the ""extreme"" stories people are mentioning to talk about a photograph. This just happens to be one of the more beautiful places I've been - nothing more, nothing less. Oneonta Gorge - OR [OC][3761x5022]",Dyatlovpass,,1489530737.0,http://i.imgur.com/gExIVT4.jpg,,False,,False,,False,False,EarthPorn,False,False,False,1113,0.78,52621
83,i4qsp5,The moon setting on the Oregon Coast [oc][1534x2301],Awayiflew,,1596716370.0,https://i.redd.it/mp0c0tytjdf51.jpg,,False,,False,,False,False,EarthPorn,False,False,False,558,0.96,52564
84,dmwxhq,Fall looks pretty darn good on this tree in Seattle (OC) [801x1200] @ross_schram,debuggerfly,,1572007454.0,https://i.redd.it/bhbtk7iqnou31.jpg,,True,,False,,False,False,EarthPorn,False,False,False,266,0.96,52523
85,5s1dd9,I was lucky enough to witness this incredible sunrise at Crater Lake National Park (OR) last weekend [OC] [2000x1333],steveschwindt,,1486224331.0,https://i.redd.it/lghllrc86vdy.jpg,,False,,False,,False,False,EarthPorn,False,False,False,522,0.92,52400
86,6m3t3m,"I thought Yosemite was beautiful, and then I went into the The Narrows in Zion[OC][5532x3688]",Oxus007,,1499551797.0,http://i.imgur.com/6aJjzIK.jpg,,False,,False,,False,False,EarthPorn,False,False,False,1047,0.89,52398
87,aq2o0d,"Since you guys like Oregon’s coast. Here’s another one! Oregon,Thunder Rock [4000x3000] [OC]",hyperkiddium,,1550032318.0,https://i.redd.it/zku2zx4dk9g21.jpg,,True,,False,,False,False,EarthPorn,False,False,False,565,0.93,52281
88,7m2393,First light on the Matterhorn [OC][2913x2167],OBEYthesky,,1514218642.0,https://imgur.com/Umw1R5m,,False,,False,,False,False,EarthPorn,False,False,True,318,0.92,52236
89,jv8qhn,I drove for 9 hours (round trip) to capture fresh snow and fall colors in Yosemite National Park in California [1600x2000] [OC],mrcnzajac,,1605540826.0,https://i.redd.it/g087xaimfmz51.jpg,,False,,False,,False,False,EarthPorn,False,False,False,551,0.9,52160
90,b0kllz,Sat in a deck chair to get this shot of Langkofel in the Dolomites [1812x2150] [OC],jetclarke,,1552474486.0,https://i.redd.it/7u7g7lrk9vl21.jpg,,True,,False,,False,False,EarthPorn,False,False,False,382,0.93,52151
91,8f2k5x,"A lonely tree 🌳under the Milky Way in Wanaka, New Zealand by Mike MacKinven [1024x1024]",IwersGuyt,,1524748621.0,https://c1.staticflickr.com/1/370/18886757823_6e0efb1745_b.jpg,,False,,False,,False,False,EarthPorn,False,False,False,679,0.93,52142
92,bx0vnb,"Huge Storm incoming, Wetterau, Germany [OC] [1611x1920]",dcdead,,1559729186.0,https://i.redd.it/khzdgo72ii231.jpg,,True,,False,,False,False,EarthPorn,False,False,False,618,0.96,52140
93,et1d57,"The spectacle of frozen methane bubbles at Abraham Lake, Alberta, Canada [OC][1233x1850]",nickphys,,1579821503.0,https://i.redd.it/j8v01amn2mc41.jpg,,True,,False,,False,False,EarthPorn,False,False,False,505,0.95,52088
94,6qeb2s,The night sky over Mt Rainier and a field of wildflowers (OC) [1335x2000],rosssvh,,1501372280.0,http://imgur.com/tavZpiF,,False,,False,,False,False,EarthPorn,False,False,False,485,0.92,51991
95,80dzh3,"Woke up at 5 AM to shoot this characteristic tree in foggy conditions, The Netherlands [OC][1920x1280]",cryptodesign,,1519660445.0,https://i.redd.it/nm3kc8kzwki01.jpg,,False,,False,,False,False,EarthPorn,False,False,False,516,0.91,51952
96,ax6w1k,"I hate writing titles, I love taking photos. An insane sunset over Three Sisters Peak in the Superstition Mountains, Arizona (OC) [1333x2000] @rosssvhphoto",debuggerfly,,1551704530.0,https://i.redd.it/2ql0f3soo3k21.jpg,,True,,False,,False,False,EarthPorn,False,False,False,434,0.88,51930
98,bi4y6u,"In 10 years of photography and hiking, I've never seen light like this. It's not even the famous view. Painted Hills, Oregon. [OC] [2048x1366]",partiallycylon,,1556407342.0,https://i.redd.it/bapw6bpr3wu21.jpg,,True,,False,,False,False,EarthPorn,False,False,False,477,0.94,51744
99,94izz1,"Rainbow Mountain in Peru peaks at just over 17,000 feet. [1125x1668][OC]",nickargiresphoto,,1533388112.0,https://i.imgur.com/qlnvgot.jpg,,True,,False,,False,False,EarthPorn,False,False,False,548,0.91,51725
100,8srvr5,Saw this beautiful scene next to the road when driving around and had to stop for it. Took a very long exposure and this was the result! Italy (OC)[1920x1280],cryptodesign,,1529587958.0,https://i.redd.it/96isdj6jwc511.jpg,,True,,False,,False,False,EarthPorn,False,False,False,420,0.93,51674
101,6wr9l7,"Not your ordinary creek in the Hocking Hills, Ohio. [OC] [800x1000]",mitchellkess,,1504013891.0,https://i.redd.it/gk5qucswjoiz.jpg,,False,,False,,False,False,EarthPorn,False,False,False,1642,0.93,51578
102,9i4j8m,The last light of day illuminates the White River on Mount Rainier [OC][1333x2000],jakegoslinephoto,,1537663420.0,https://i.redd.it/hxj2oftuwvn11.jpg,BestOf 2018 Winner,True,,False,,False,False,EarthPorn,False,False,False,414,0.95,51515
103,65p81c,"My morning walk in Forest Park, Portland, Oregon. [OC] [1638x2048]",robybabcock,,1492351160.0,https://i.redd.it/bhaf0iq68xry.jpg,,False,,False,,False,False,EarthPorn,False,False,False,1005,0.91,51168
